{
  "schema_version": "offline-analysis-manifest.v0.1",
  "analysis_id": "ANALYSIS-ed0e144a99f33a50",
  "analysis_fingerprint_sha256": "ed0e144a99f33a50af062b7c354113e3764fca16d001e227c7e01c307646a5c6",
  "session_id": "SYNTH_D4_WARN_POWERLINE",
  "status": "completed_with_warnings",
  "execution_mode": "offline_file_based",
  "source": {
    "manifest_file_name": "qc_warning_powerline.manifest.json",
    "source_hash_sha256": "29d706f83641d5d2409ff0a286da0ea802c249573a07594704c9b06f3b8cb3e2"
  },
  "pipeline": {
    "config_id": "offline_analysis_mvp0",
    "config_hashes": {
      "fatigue_evidence": "c2d7033a6272d12ed6b0c7f8affc4e2b1486ee8bcd24cd2b876adaaf8f32fa46",
      "fatigue_rule": "803726ca4fdd8caef294e906bb375faa07347ec61f84f07849dc69d77c0216bc",
      "frequency_features": "5564cee72bab9a8430d65cdb7e21130be2f6e9aed14b4d8850c39ea585b04657",
      "offline_analysis_profile": "a85e4eb503e3bd335e9c60d96e2f3e374b2399ef7ccc61538471a8f44358f6bc",
      "preprocessing": "844e19bb7da7161deadd51c3aeece0ddebf314e0c57b112f96bbf269454e56fa",
      "protocol": "130a6a0c95d6bff0eb57880c261b343c87d0e5a54c4537815c006ec069c847f2",
      "qc": "c93b857fca0fa392546795e74422da4ec002c3dcc21ccf7eee3c1ee73b167017",
      "spectral_estimation": "5d61d0e5bad62e0caabda49df6593eb160fdc45fef91086554177cc3d95b134e",
      "technical_confidence": "e5b92ff93c43da3c1f12fdc8a18f25a4e26edf188cfe0d98da7b7c2683610d80",
      "time_features": "a450d807b398fcb8d99d365d8f13eb4ed5f2b102428af3d24126c17b58c768a2",
      "trend_features": "c254f2ab77bed227ee211a818f93362c377fe453e822bc09fbfcd3b94232acd1",
      "windowing": "31b8a43efb9a360369d2b2af5b15bea0eadc4f6935abe5475e299a0d3d5c33c8"
    },
    "stage_records": [
      {
        "stage_id": "ingestion",
        "status": "completed",
        "downstream_allowed": true,
        "output_file": "00-ingestion-summary.json",
        "output_payload_sha256": "a18bd960cc6fedd72e1dc0704bcf40614e272563419719c1129fa9871c82a16c",
        "config_id": null,
        "reason_codes": []
      },
      {
        "stage_id": "qc",
        "status": "warning",
        "downstream_allowed": true,
        "output_file": "01-qc-result.json",
        "output_payload_sha256": "90b3825c1bfc4f701afa6fcc46b99f4cf691e09f68d1ba4ebd2c80b212ddb54e",
        "config_id": null,
        "reason_codes": [
          "POWERLINE_NOISE_HIGH"
        ]
      },
      {
        "stage_id": "preprocessing",
        "status": "completed",
        "downstream_allowed": true,
        "output_file": "02-preprocessing-result.json",
        "output_payload_sha256": "33d8a6f32f56c1cb5c7eb7ad9fc0ce847344a4260a001288c699cdd9d7d6e533",
        "config_id": "preprocess_v0.1",
        "reason_codes": []
      },
      {
        "stage_id": "windowing",
        "status": "completed",
        "downstream_allowed": true,
        "output_file": "03-windowing-result.json",
        "output_payload_sha256": "5d7f550bda947774e0a29daa5f2816f010cd92f0f0dfbe734187589c1a5bfd8a",
        "config_id": "windowing_v0.1",
        "reason_codes": []
      },
      {
        "stage_id": "time_features",
        "status": "completed",
        "downstream_allowed": true,
        "output_file": "04-time-domain-features.json",
        "output_payload_sha256": "06adf8bbccadc79481a82e2d2213ef84423d22fc9f02edb8aaf8f838cdc1551d",
        "config_id": "features_semg_v0.1",
        "reason_codes": []
      },
      {
        "stage_id": "spectral_estimation",
        "status": "completed",
        "downstream_allowed": true,
        "output_file": "05-spectral-estimation.json",
        "output_payload_sha256": "6d501677755ec9ae68f787a8520d4fd9821932c425cfe0279180996bc7189940",
        "config_id": "spectral_estimation_v0.1",
        "reason_codes": []
      },
      {
        "stage_id": "frequency_features",
        "status": "completed",
        "downstream_allowed": true,
        "output_file": "06-frequency-features.json",
        "output_payload_sha256": "caf6328e2c0e29172475a98dcfd891143b53b5dfc8b2d7ab18fd0ba690b62362",
        "config_id": "frequency_features_v0.1",
        "reason_codes": []
      },
      {
        "stage_id": "trend_features",
        "status": "completed",
        "downstream_allowed": true,
        "output_file": "07-trend-features.json",
        "output_payload_sha256": "a2a4ec103ec7281bd7726c8ee5fd60ab02bb82480ace8e9f01e9b1265f8360ee",
        "config_id": "trend_features_v0.1",
        "reason_codes": []
      },
      {
        "stage_id": "fatigue_evidence",
        "status": "completed",
        "downstream_allowed": true,
        "output_file": "08-fatigue-evidence.json",
        "output_payload_sha256": "4c44c019092bdd8dd330dca115c7d95ff8d77aee261e1eb32d28e86b1b5df6fb",
        "config_id": "fatigue_evidence_v0.1",
        "reason_codes": []
      },
      {
        "stage_id": "fatigue_rule",
        "status": "completed",
        "downstream_allowed": true,
        "output_file": "09-fatigue-rule.json",
        "output_payload_sha256": "ab3c480b75f4b8eb2fbd9e98149d05941ab33ef97cc9341a6f9d3324238b220d",
        "config_id": "fatigue_rule_v0.1",
        "reason_codes": [
          "RULE_ALL_CHANNELS_SUPPORT_PATTERN"
        ]
      },
      {
        "stage_id": "explainable_inference",
        "status": "completed_with_warnings",
        "downstream_allowed": true,
        "output_file": "10-explainable-inference.json",
        "output_payload_sha256": "2855c0de438897f92ccd56eadd0eacf512738676dcdabaaa64e5fa584430ab23",
        "config_id": "technical_confidence_v0.1",
        "reason_codes": [
          "INFERENCE_COMPLETED_WITH_QC_WARNING"
        ]
      }
    ]
  },
  "final": {
    "technical_conclusion": "supported_pattern",
    "engineering_confidence_category": "engineering_high",
    "clinical_use_allowed": false,
    "human_review_required": true
  },
  "runtime_versions": {
    "python": "3.12.3",
    "numpy": "2.5.1",
    "scipy": "1.18.0",
    "semg_core": "0.1.0"
  },
  "safety": {
    "quality_gate_blocks_unsafe_analysis": true,
    "abstention_is_first_class_output": true,
    "no_raw_samples_in_json": true,
    "no_direct_patient_identifier_in_output": true,
    "no_probability": true,
    "no_frs": true,
    "no_diagnosis": true,
    "no_treatment_recommendation": true,
    "no_return_to_play_decision": true,
    "human_review_required": true,
    "clinical_use_allowed": false,
    "synthetic_data_is_not_clinical_evidence": true
  },
  "limitations": [
    "Pipeline MVP-0 chỉ được kiểm chứng trên synthetic fixtures và generic CSV contract.",
    "Output là technical analysis package, chưa phải clinical report cuối cùng.",
    "Không có FRS, MFCV thực tế, ML local hoặc clinical calibration trong phiên bản này."
  ]
}
