{
  "schema_version": "offline-analysis-manifest.v0.1",
  "analysis_id": "ANALYSIS-27d995d60e09ed60",
  "analysis_fingerprint_sha256": "27d995d60e09ed6073ccb04e4422d54671fc457a682d8cf14d1c1ae321ba3e20",
  "session_id": "SYNTH_D4_WARN_MOTION",
  "status": "completed_with_warnings",
  "execution_mode": "offline_file_based",
  "source": {
    "manifest_file_name": "qc_warning_motion_artifact.manifest.json",
    "source_hash_sha256": "09154938ae12dfb8eee034676e46bc22285af55d569bb22b32733aad9f908c0b"
  },
  "pipeline": {
    "config_id": "offline_analysis_mvp0",
    "config_hashes": {
      "fatigue_evidence": "c2d7033a6272d12ed6b0c7f8affc4e2b1486ee8bcd24cd2b876adaaf8f32fa46",
      "fatigue_rule": "803726ca4fdd8caef294e906bb375faa07347ec61f84f07849dc69d77c0216bc",
      "frequency_features": "5564cee72bab9a8430d65cdb7e21130be2f6e9aed14b4d8850c39ea585b04657",
      "offline_analysis_profile": "a85e4eb503e3bd335e9c60d96e2f3e374b2399ef7ccc61538471a8f44358f6bc",
      "preprocessing": "844e19bb7da7161deadd51c3aeece0ddebf314e0c57b112f96bbf269454e56fa",
      "protocol": "130a6a0c95d6bff0eb57880c261b343c87d0e5a54c4537815c006ec069c847f2",
      "qc": "c93b857fca0fa392546795e74422da4ec002c3dcc21ccf7eee3c1ee73b167017",
      "spectral_estimation": "5d61d0e5bad62e0caabda49df6593eb160fdc45fef91086554177cc3d95b134e",
      "technical_confidence": "e5b92ff93c43da3c1f12fdc8a18f25a4e26edf188cfe0d98da7b7c2683610d80",
      "time_features": "a450d807b398fcb8d99d365d8f13eb4ed5f2b102428af3d24126c17b58c768a2",
      "trend_features": "c254f2ab77bed227ee211a818f93362c377fe453e822bc09fbfcd3b94232acd1",
      "windowing": "31b8a43efb9a360369d2b2af5b15bea0eadc4f6935abe5475e299a0d3d5c33c8"
    },
    "stage_records": [
      {
        "stage_id": "ingestion",
        "status": "completed",
        "downstream_allowed": true,
        "output_file": "00-ingestion-summary.json",
        "output_payload_sha256": "65451d17a2971ca7b2e9e2e73b8a4c72200b39a24af13380e7cf680585328f9c",
        "config_id": null,
        "reason_codes": []
      },
      {
        "stage_id": "qc",
        "status": "warning",
        "downstream_allowed": true,
        "output_file": "01-qc-result.json",
        "output_payload_sha256": "342e65a7499b64151bed2e630dc16fe1e68aab5725f5f8950d0ef7ae951528a5",
        "config_id": null,
        "reason_codes": [
          "MOTION_ARTIFACT_HIGH"
        ]
      },
      {
        "stage_id": "preprocessing",
        "status": "completed",
        "downstream_allowed": true,
        "output_file": "02-preprocessing-result.json",
        "output_payload_sha256": "2d7a8806e70362a2fa2fc1b042a38e888be83b3ca666e10877126d9724a2fced",
        "config_id": "preprocess_v0.1",
        "reason_codes": []
      },
      {
        "stage_id": "windowing",
        "status": "completed",
        "downstream_allowed": true,
        "output_file": "03-windowing-result.json",
        "output_payload_sha256": "1c123868efcbd7063a399f448b6777257f048e2a1e0429e2d989342374008170",
        "config_id": "windowing_v0.1",
        "reason_codes": []
      },
      {
        "stage_id": "time_features",
        "status": "completed",
        "downstream_allowed": true,
        "output_file": "04-time-domain-features.json",
        "output_payload_sha256": "04b05ea1b111a0c9cf68e707b7acd24f87c395d247aa58b3745f6d8454161bda",
        "config_id": "features_semg_v0.1",
        "reason_codes": []
      },
      {
        "stage_id": "spectral_estimation",
        "status": "completed",
        "downstream_allowed": true,
        "output_file": "05-spectral-estimation.json",
        "output_payload_sha256": "25451b98e6ebef4d7d8e7b585f06ea71afc3af81a09c23a5ed4bf4ec67ace6a4",
        "config_id": "spectral_estimation_v0.1",
        "reason_codes": []
      },
      {
        "stage_id": "frequency_features",
        "status": "completed",
        "downstream_allowed": true,
        "output_file": "06-frequency-features.json",
        "output_payload_sha256": "0a3095680987ad50368dbf56511f47831f12446e25f831c4cc319402ff1121e8",
        "config_id": "frequency_features_v0.1",
        "reason_codes": []
      },
      {
        "stage_id": "trend_features",
        "status": "completed",
        "downstream_allowed": true,
        "output_file": "07-trend-features.json",
        "output_payload_sha256": "56dbf1ed3bee1375d1e2d6ae1f6c94c87610f07304b70ae2e5aa92ba21b8be7c",
        "config_id": "trend_features_v0.1",
        "reason_codes": []
      },
      {
        "stage_id": "fatigue_evidence",
        "status": "completed",
        "downstream_allowed": true,
        "output_file": "08-fatigue-evidence.json",
        "output_payload_sha256": "f524472e02f2504730983b53a230f6fd8b7e3311903ed93eb4d71b8de41acb70",
        "config_id": "fatigue_evidence_v0.1",
        "reason_codes": []
      },
      {
        "stage_id": "fatigue_rule",
        "status": "completed",
        "downstream_allowed": true,
        "output_file": "09-fatigue-rule.json",
        "output_payload_sha256": "7a396f13de86b111cd527d6a5a0c649b7af0aa6e15598fbb60d5183947fcb4c8",
        "config_id": "fatigue_rule_v0.1",
        "reason_codes": [
          "RULE_ALL_CHANNELS_SUPPORT_PATTERN"
        ]
      },
      {
        "stage_id": "explainable_inference",
        "status": "completed_with_warnings",
        "downstream_allowed": true,
        "output_file": "10-explainable-inference.json",
        "output_payload_sha256": "a7ce7e589b37bf7890f62a4ea0a6b5d3c472b401c3f0a710ce0bfdcc7c72b1d2",
        "config_id": "technical_confidence_v0.1",
        "reason_codes": [
          "INFERENCE_COMPLETED_WITH_QC_WARNING"
        ]
      }
    ]
  },
  "final": {
    "technical_conclusion": "supported_pattern",
    "engineering_confidence_category": "engineering_high",
    "clinical_use_allowed": false,
    "human_review_required": true
  },
  "runtime_versions": {
    "python": "3.12.3",
    "numpy": "2.5.1",
    "scipy": "1.18.0",
    "semg_core": "0.1.0"
  },
  "safety": {
    "quality_gate_blocks_unsafe_analysis": true,
    "abstention_is_first_class_output": true,
    "no_raw_samples_in_json": true,
    "no_direct_patient_identifier_in_output": true,
    "no_probability": true,
    "no_frs": true,
    "no_diagnosis": true,
    "no_treatment_recommendation": true,
    "no_return_to_play_decision": true,
    "human_review_required": true,
    "clinical_use_allowed": false,
    "synthetic_data_is_not_clinical_evidence": true
  },
  "limitations": [
    "Pipeline MVP-0 chỉ được kiểm chứng trên synthetic fixtures và generic CSV contract.",
    "Output là technical analysis package, chưa phải clinical report cuối cùng.",
    "Không có FRS, MFCV thực tế, ML local hoặc clinical calibration trong phiên bản này."
  ]
}
