{
  "schema_version": "offline-analysis-manifest.v0.1",
  "analysis_id": "ANALYSIS-6087868b625f8771",
  "analysis_fingerprint_sha256": "6087868b625f877194c6f7501cd755e19a724e551e71f1fd65be87afdd09bebb",
  "session_id": "SYNTH_D4_FAIL_FLATLINE",
  "status": "abstained",
  "execution_mode": "offline_file_based",
  "source": {
    "manifest_file_name": "qc_fail_flatline.manifest.json",
    "source_hash_sha256": "7471e3d2d20fb7b37c04177943d8fe42ab1ae753108c69a08a9d03903ec6b4d4"
  },
  "pipeline": {
    "config_id": "offline_analysis_mvp0",
    "config_hashes": {
      "fatigue_evidence": "c2d7033a6272d12ed6b0c7f8affc4e2b1486ee8bcd24cd2b876adaaf8f32fa46",
      "fatigue_rule": "803726ca4fdd8caef294e906bb375faa07347ec61f84f07849dc69d77c0216bc",
      "frequency_features": "5564cee72bab9a8430d65cdb7e21130be2f6e9aed14b4d8850c39ea585b04657",
      "offline_analysis_profile": "a85e4eb503e3bd335e9c60d96e2f3e374b2399ef7ccc61538471a8f44358f6bc",
      "preprocessing": "844e19bb7da7161deadd51c3aeece0ddebf314e0c57b112f96bbf269454e56fa",
      "protocol": "130a6a0c95d6bff0eb57880c261b343c87d0e5a54c4537815c006ec069c847f2",
      "qc": "c93b857fca0fa392546795e74422da4ec002c3dcc21ccf7eee3c1ee73b167017",
      "spectral_estimation": "5d61d0e5bad62e0caabda49df6593eb160fdc45fef91086554177cc3d95b134e",
      "technical_confidence": "e5b92ff93c43da3c1f12fdc8a18f25a4e26edf188cfe0d98da7b7c2683610d80",
      "time_features": "a450d807b398fcb8d99d365d8f13eb4ed5f2b102428af3d24126c17b58c768a2",
      "trend_features": "c254f2ab77bed227ee211a818f93362c377fe453e822bc09fbfcd3b94232acd1",
      "windowing": "31b8a43efb9a360369d2b2af5b15bea0eadc4f6935abe5475e299a0d3d5c33c8"
    },
    "stage_records": [
      {
        "stage_id": "ingestion",
        "status": "completed",
        "downstream_allowed": true,
        "output_file": "00-ingestion-summary.json",
        "output_payload_sha256": "962fd5b13dacb3fc7b31365e41982a965970ed40b34587d2b728c90a6adb9c0d",
        "config_id": null,
        "reason_codes": []
      },
      {
        "stage_id": "qc",
        "status": "fail",
        "downstream_allowed": false,
        "output_file": "01-qc-result.json",
        "output_payload_sha256": "4a79e5a2c3ea19c9117a9c2128c08e470c5d70d15c7235f5068b3e517a1e6def",
        "config_id": null,
        "reason_codes": [
          "FLATLINE_EXCESSIVE"
        ]
      },
      {
        "stage_id": "preprocessing",
        "status": "blocked",
        "downstream_allowed": false,
        "output_file": "02-preprocessing-result.json",
        "output_payload_sha256": "fd657133fcd6ab21367c545c652e429acbc2cfd6642a43d273068b92056f002e",
        "config_id": "preprocess_v0.1",
        "reason_codes": [
          "PREPROCESSING_BLOCKED_BY_QC",
          "FLATLINE_EXCESSIVE"
        ]
      },
      {
        "stage_id": "windowing",
        "status": "blocked",
        "downstream_allowed": false,
        "output_file": "03-windowing-result.json",
        "output_payload_sha256": "c6f3c3e8eb68f7203722164e2fd50d964a84abe04141259ba505a3fcf74ba867",
        "config_id": "windowing_v0.1",
        "reason_codes": [
          "WINDOWING_BLOCKED_BY_PREPROCESSING",
          "PREPROCESSING_BLOCKED_BY_QC",
          "FLATLINE_EXCESSIVE"
        ]
      },
      {
        "stage_id": "time_features",
        "status": "blocked",
        "downstream_allowed": false,
        "output_file": "04-time-domain-features.json",
        "output_payload_sha256": "5a3f7c90f0135ff470fff9b1ba8d64c517798c950a74c6df2f49c84eb2ba58b2",
        "config_id": "features_semg_v0.1",
        "reason_codes": [
          "FEATURE_EXTRACTION_BLOCKED_BY_WINDOWING"
        ]
      },
      {
        "stage_id": "spectral_estimation",
        "status": "blocked",
        "downstream_allowed": false,
        "output_file": "05-spectral-estimation.json",
        "output_payload_sha256": "f9477d0a0938b1c8bb10fc0076dcca0deac6c38d98bbd23be0b3317eb4077874",
        "config_id": "spectral_estimation_v0.1",
        "reason_codes": [
          "SPECTRAL_ESTIMATION_BLOCKED_BY_WINDOWING"
        ]
      },
      {
        "stage_id": "frequency_features",
        "status": "blocked",
        "downstream_allowed": false,
        "output_file": "06-frequency-features.json",
        "output_payload_sha256": "eea21008be203db2ecdca20e39b2c903d29c6e6777e02173ad7aec3423947637",
        "config_id": "frequency_features_v0.1",
        "reason_codes": [
          "FREQ_FEATURE_BLOCKED_BY_SPECTRAL"
        ]
      },
      {
        "stage_id": "trend_features",
        "status": "blocked",
        "downstream_allowed": false,
        "output_file": "07-trend-features.json",
        "output_payload_sha256": "de1e8a9b8425897c363611bd49b6d9f086aaf41e2b62d711839f950944f201a9",
        "config_id": "trend_features_v0.1",
        "reason_codes": [
          "TREND_BLOCKED_BY_UPSTREAM"
        ]
      },
      {
        "stage_id": "fatigue_evidence",
        "status": "abstained",
        "downstream_allowed": false,
        "output_file": "08-fatigue-evidence.json",
        "output_payload_sha256": "4a4f1db41989236cac66c15779091019471d27d4a789c59170924ea3775efcdb",
        "config_id": "fatigue_evidence_v0.1",
        "reason_codes": [
          "EVIDENCE_ABSTAINED_BY_TREND"
        ]
      },
      {
        "stage_id": "fatigue_rule",
        "status": "abstained",
        "downstream_allowed": false,
        "output_file": "09-fatigue-rule.json",
        "output_payload_sha256": "27e19e1053b1c269f3cf5faa920c5fd49ba1503ca2878244d9ca71c7020384ba",
        "config_id": "fatigue_rule_v0.1",
        "reason_codes": [
          "RULE_ABSTAINED_BY_EVIDENCE"
        ]
      },
      {
        "stage_id": "explainable_inference",
        "status": "abstained",
        "downstream_allowed": false,
        "output_file": "10-explainable-inference.json",
        "output_payload_sha256": "e77316f9e036c0ab972be11ef5f91e99ee544889a51c6f72d8f4a81e3800ce30",
        "config_id": "technical_confidence_v0.1",
        "reason_codes": [
          "INFERENCE_ABSTAINED_BY_RULE"
        ]
      }
    ]
  },
  "final": {
    "technical_conclusion": "abstained",
    "engineering_confidence_category": "not_available",
    "clinical_use_allowed": false,
    "human_review_required": true
  },
  "runtime_versions": {
    "python": "3.12.3",
    "numpy": "2.5.1",
    "scipy": "1.18.0",
    "semg_core": "0.1.0"
  },
  "safety": {
    "quality_gate_blocks_unsafe_analysis": true,
    "abstention_is_first_class_output": true,
    "no_raw_samples_in_json": true,
    "no_direct_patient_identifier_in_output": true,
    "no_probability": true,
    "no_frs": true,
    "no_diagnosis": true,
    "no_treatment_recommendation": true,
    "no_return_to_play_decision": true,
    "human_review_required": true,
    "clinical_use_allowed": false,
    "synthetic_data_is_not_clinical_evidence": true
  },
  "limitations": [
    "Pipeline MVP-0 chỉ được kiểm chứng trên synthetic fixtures và generic CSV contract.",
    "Output là technical analysis package, chưa phải clinical report cuối cùng.",
    "Không có FRS, MFCV thực tế, ML local hoặc clinical calibration trong phiên bản này."
  ]
}
